[
  {
    "id": 100,
    "name": {
      "en": "1 (One)",
      "hi": "1 (एक)",
      "gu": "1 (એક)"
    },
    "media": {
      "image": "icons/numbers/numbers-1.png"
    },
    "meta": {
      "number": 1,
      "category": "numbers",
      "order": 1
    },
    "tags": [
      "number",
      "counting",
      "kids"
    ],
    "accessibility": {
      "altText": {
        "en": "Number one",
        "hi": "संख्या एक",
        "gu": "નંબર એક"
      }
    },
    "slug": "1-one"
  },
  {
    "id": 101,
    "name": {
      "en": "2 (Two)",
      "hi": "2 (दो)",
      "gu": "2 (બે)"
    },
    "media": {
      "image": "icons/numbers/numbers-2.png"
    },
    "meta": {
      "number": 2,
      "category": "numbers",
      "order": 2
    },
    "tags": [
      "number",
      "counting",
      "kids"
    ],
    "accessibility": {
      "altText": {
        "en": "Number two",
        "hi": "संख्या दो",
        "gu": "નંબર બે"
      }
    },
    "slug": "2-two"
  },
  {
    "id": 102,
    "name": {
      "en": "3 (Three)",
      "hi": "3 (तीन)",
      "gu": "3 (ત્રણ)"
    },
    "media": {
      "image": "icons/numbers/numbers-3.png"
    },
    "meta": {
      "number": 3,
      "category": "numbers",
      "order": 3
    },
    "tags": [
      "number",
      "counting",
      "kids"
    ],
    "accessibility": {
      "altText": {
        "en": "Number three",
        "hi": "संख्या तीन",
        "gu": "નંબર ત્રણ"
      }
    },
    "slug": "3-three"
  },
  {
    "id": 103,
    "name": {
      "en": "4 (Four)",
      "hi": "4 (चार)",
      "gu": "4 (ચાર)"
    },
    "media": {
      "image": "icons/numbers/numbers-4.png"
    },
    "meta": {
      "number": 4,
      "category": "numbers",
      "order": 4
    },
    "tags": [
      "number",
      "counting",
      "kids"
    ],
    "accessibility": {
      "altText": {
        "en": "Number four",
        "hi": "संख्या चार",
        "gu": "નંબર ચાર"
      }
    },
    "slug": "4-four"
  },
  {
    "id": 104,
    "name": {
      "en": "5 (Five)",
      "hi": "5 (पाँच)",
      "gu": "5 (પાંચ)"
    },
    "media": {
      "image": "icons/numbers/numbers-5.png"
    },
    "meta": {
      "number": 5,
      "category": "numbers",
      "order": 5
    },
    "tags": [
      "number",
      "counting",
      "kids"
    ],
    "accessibility": {
      "altText": {
        "en": "Number five",
        "hi": "संख्या पाँच",
        "gu": "નંબર પાંચ"
      }
    },
    "slug": "5-five"
  },
  {
    "id": 105,
    "name": {
      "en": "6 (Six)",
      "hi": "6 (छह)",
      "gu": "6 (છ)"
    },
    "media": {
      "image": "icons/numbers/numbers-6.png"
    },
    "meta": {
      "number": 6,
      "category": "numbers",
      "order": 6
    },
    "tags": [
      "number",
      "counting",
      "kids"
    ],
    "accessibility": {
      "altText": {
        "en": "Number six",
        "hi": "संख्या छह",
        "gu": "નંબર છ"
      }
    },
    "slug": "6-six"
  },
  {
    "id": 106,
    "name": {
      "en": "7 (Seven)",
      "hi": "7 (सात)",
      "gu": "7 (સાત)"
    },
    "media": {
      "image": "icons/numbers/numbers-7.png"
    },
    "meta": {
      "number": 7,
      "category": "numbers",
      "order": 7
    },
    "tags": [
      "number",
      "counting",
      "kids"
    ],
    "accessibility": {
      "altText": {
        "en": "Number seven",
        "hi": "संख्या सात",
        "gu": "નંબર સાત"
      }
    },
    "slug": "7-seven"
  },
  {
    "id": 107,
    "name": {
      "en": "8 (Eight)",
      "hi": "8 (आठ)",
      "gu": "8 (આઠ)"
    },
    "media": {
      "image": "icons/numbers/numbers-8.png"
    },
    "meta": {
      "number": 8,
      "category": "numbers",
      "order": 8
    },
    "tags": [
      "number",
      "counting",
      "kids"
    ],
    "accessibility": {
      "altText": {
        "en": "Number eight",
        "hi": "संख्या आठ",
        "gu": "નંબર આઠ"
      }
    },
    "slug": "8-eight"
  },
  {
    "id": 108,
    "name": {
      "en": "9 (Nine)",
      "hi": "9 (नौ)",
      "gu": "9 (નવ)"
    },
    "media": {
      "image": "icons/numbers/numbers-9.png"
    },
    "meta": {
      "number": 9,
      "category": "numbers",
      "order": 9
    },
    "tags": [
      "number",
      "counting",
      "kids"
    ],
    "accessibility": {
      "altText": {
        "en": "Number nine",
        "hi": "संख्या नौ",
        "gu": "નંબર નવ"
      }
    },
    "slug": "9-nine"
  }
]
