[
  {
    "id": 700,
    "name": {
      "en": "Crane",
      "hi": "क्रेन",
      "gu": "ક્રેન"
    },
    "media": {
      "image": "icons/vehicles/vehicles-crane.png"
    },
    "meta": {
      "category": "vehicles",
      "order": 1
    },
    "tags": [
      "vehicle",
      "transport",
      "kids"
    ],
    "accessibility": {
      "altText": {
        "en": "Crane",
        "hi": "क्रेन",
        "gu": "ક્રેન"
      }
    },
    "slug": "crane"
  },
  {
    "id": 701,
    "name": {
      "en": "Air Balloon",
      "hi": "हवाई गुब्बारा",
      "gu": "એર બલૂન"
    },
    "media": {
      "image": "icons/vehicles/vehicles-air-balloon.png"
    },
    "meta": {
      "category": "vehicles",
      "order": 2
    },
    "tags": [
      "vehicle",
      "transport",
      "kids"
    ],
    "accessibility": {
      "altText": {
        "en": "Air Balloon",
        "hi": "हवाई गुब्बारा",
        "gu": "એર બલૂન"
      }
    },
    "slug": "air-balloon"
  },
  {
    "id": 702,
    "name": {
      "en": "Airplane",
      "hi": "विमान",
      "gu": "વિમાન"
    },
    "media": {
      "image": "icons/vehicles/vehicles-airplane.png"
    },
    "meta": {
      "category": "vehicles",
      "order": 3
    },
    "tags": [
      "vehicle",
      "transport",
      "kids"
    ],
    "accessibility": {
      "altText": {
        "en": "Airplane",
        "hi": "विमान",
        "gu": "વિમાન"
      }
    },
    "slug": "airplane"
  },
  {
    "id": 703,
    "name": {
      "en": "Ambulance",
      "hi": "एम्बुलेंस",
      "gu": "એંબ્યુલન્સ"
    },
    "media": {
      "image": "icons/vehicles/vehicles-ambulance.png"
    },
    "meta": {
      "category": "vehicles",
      "order": 4
    },
    "tags": [
      "vehicle",
      "transport",
      "kids"
    ],
    "accessibility": {
      "altText": {
        "en": "Ambulance",
        "hi": "एम्बुलेंस",
        "gu": "એંબ્યુલન્સ"
      }
    },
    "slug": "ambulance"
  },
  {
    "id": 704,
    "name": {
      "en": "Auto",
      "hi": "ऑटो",
      "gu": "ઓટો"
    },
    "media": {
      "image": "icons/vehicles/vehicles-auto.png"
    },
    "meta": {
      "category": "vehicles",
      "order": 5
    },
    "tags": [
      "vehicle",
      "transport",
      "kids"
    ],
    "accessibility": {
      "altText": {
        "en": "Auto",
        "hi": "ऑटो",
        "gu": "ઓટો"
      }
    },
    "slug": "auto"
  },
  {
    "id": 705,
    "name": {
      "en": "Bicycle",
      "hi": "साइकिल",
      "gu": "સાઇકલ"
    },
    "media": {
      "image": "icons/vehicles/vehicles-bicycle.png"
    },
    "meta": {
      "category": "vehicles",
      "order": 6
    },
    "tags": [
      "vehicle",
      "transport",
      "kids"
    ],
    "accessibility": {
      "altText": {
        "en": "Bicycle",
        "hi": "साइकिल",
        "gu": "સાઇકલ"
      }
    },
    "slug": "bicycle"
  },
  {
    "id": 706,
    "name": {
      "en": "Bike",
      "hi": "बाइक",
      "gu": "બાઈક"
    },
    "media": {
      "image": "icons/vehicles/vehicles-bike.png"
    },
    "meta": {
      "category": "vehicles",
      "order": 7
    },
    "tags": [
      "vehicle",
      "transport",
      "kids"
    ],
    "accessibility": {
      "altText": {
        "en": "Bike",
        "hi": "बाइक",
        "gu": "બાઈક"
      }
    },
    "slug": "bike"
  },
  {
    "id": 707,
    "name": {
      "en": "Boat",
      "hi": "नाव",
      "gu": "નૌકા"
    },
    "media": {
      "image": "icons/vehicles/vehicles-boat.png"
    },
    "meta": {
      "category": "vehicles",
      "order": 8
    },
    "tags": [
      "vehicle",
      "transport",
      "kids"
    ],
    "accessibility": {
      "altText": {
        "en": "Boat",
        "hi": "नाव",
        "gu": "નૌકા"
      }
    },
    "slug": "boat"
  },
  {
    "id": 708,
    "name": {
      "en": "Bus",
      "hi": "बस",
      "gu": "બસ"
    },
    "media": {
      "image": "icons/vehicles/vehicles-bus.png"
    },
    "meta": {
      "category": "vehicles",
      "order": 9
    },
    "tags": [
      "vehicle",
      "transport",
      "kids"
    ],
    "accessibility": {
      "altText": {
        "en": "Bus",
        "hi": "बस",
        "gu": "બસ"
      }
    },
    "slug": "bus"
  }
]
